number,sector,phaseTitle,title,description,challenge,Impact,AISuitability,Novelty,ai1,ai2,ai3
56,Agriculture,Management & Operations,Optimising farming resources,"AI can be used to help optimise resources used in agriculture applications such as crop production and irrigation such as water, fertiliser and pesticides. Efficiency can also be improved by utilising solar power (for example for pumps) instead of diesel driven ones.",,2,3,1,TimeSeries,Optimisation,Geospatial
57,Agriculture,Management & Operations,Livestock breeding programmes,"The methane emissions from livestock can be affected by numerous factors such as animal size, feed conversion efficiency, and growth rate, which are driven by genetic factors, and therefore breeding programmes can select those animals which are likely to have lowest future greenhouse gas emissions. AI can be used to identify the traits which can produce lower emission offspring.",GC7,2,2,2,TimeSeries,Optimisation,OtherML
58,Agriculture,Management & Operations,Manure treatment,"Manure is another major contributor to methane emissions. However, there are several treatment approaches that can help reduce these including acidification, and aeration. Manure can also be used to generate bio energy when mixed with substances such as grass and feedstock to produce biogas. AI can be used to identify optimal operating conditions.",GC7,2,2,2,Visual,Optimisation,OtherML
59,Agriculture,Management & Operations,Soil health monitoring and management,Monitoring of soil health can help enhance crop productivity and sequester carbon. Monitoring soil health can reduce fertiliser requirements and hence emissions. AI can help both automate monitoring and recommend optimal actions.,GC6,3,2,2,Visual,Optimisation,Geospatial
60,Agriculture,Management & Operations,Crop monitoring and management,"Optimal crop rotations can help support soil health & emissions reduction, and enable more efficient utilisation of resources. AI can be used to recommend and monitor crop rotation schedules. Image processing, satellites and drone-based AI can also help support the early detection of crop diseases, reducing the losses of crops and ensuring optimal land use.",GC6,2,2,2,Visual,Optimisation,Geospatial
61,Agriculture,Incentives & Consumer Support,Low carbon diets,Shifting to lower carbon diets could play a significant role in helping decarbonise agriculture. AI-assisted understanding of consumer behaviour and preferences would allow information and marketing to be more effectively personalised for different consumers to help them transition to a lower carbon diet.,GC7,3,2,3,Language,Optimisation,OtherML
62,Built Environment,Design & Planning,Identifying and targeting optimal retrofit measures,"Households have different building characteristics, energy usage & devices, so the best retrofit pathway for a household (or business) varies. AI can combine data sources, model different interventions & forecast savings to help identify optimal retrofit pathways. This could be done for individual properties or at scale to enable appropriate targeting of retrofit offers.",GC1,3,3,2,Visual,Optimisation,Geospatial
63,Built Environment,Design & Planning,Retrofit design,"Some retrofits such as heat pumps must be sized to ensure they can achieve the desired temperatures for the home. The design process for these is lengthy and inconsistent, making it harder for consumers to decarbonise their homes. AI could support this process through automated data collection (e.g. building layout or heat loss) and system design optimisation/recommendations.",GC1,2,3,2,Visual,TimeSeries,Optimisation
64,Built Environment,Design & Planning,Retrofit approvals,"High demand devices (e.g. heat pumps and EVs) often require approval before connection to the electricity network, which can be a lengthy process. AI can be used to help speed up and improve the approval process by automating modelling of these connections and enabling automatic approval of the majority of them.",GC1,2,2,3,Language,Geospatial,OtherML
65,Built Environment,Design & Planning,Retrofit installation and commissioning,"Retrofit performance varies significantly, with a well designed & installed heat pump having up to 50% higher efficiency than a poorly installed equivalent. Variations in quality of install and commissioning may be down to a shortage of skilled installers. AI could improve this by accelerating training, augmenting the installation process, and automating improved quality assurance.",GC1,3,2,3,Visual,Language,TimeSeries
66,Built Environment,Management & Operations,Smart building control systems,"Increased monitoring and control buildings allows better optimisation of building energy usage. AI can help smart buildings achieve target comfort levels with lower energy usage, as well as shifting energy usage to less carbon intensive times of day. AI can also automate participation in demand response programmes to balance demand and supply in the network.",GC3,3,3,1,Visual,TimeSeries,Optimisation
67,Built Environment,Incentives & Consumer Support,Measuring retrofit impact,"It is difficult to calculate the effect of a retrofit on energy consumption since there is no way to compare to the unmodified energy usage had the retrofit not been applied. AI can estimate the savings through modelling of the demand. Such modelling would increase consumer confidence in retrofits, but also unlock new funding models (as funding could be tied to long term savings).",GC1,3,2,2,Visual,TimeSeries,OtherML
68,Built Environment,Incentives & Consumer Support,Standardised building performance ratings,"Currently building energy performance is reported via EPCs, but these are based on major assumptions (e.g.  typical  occupancy profiles) and have been shown to have significant limitations. AI could be used to provide better measures of building performance (e.g. energy efficiency, heat transfer, effects of weather) via analysis of actual energy demand.",GC1,2,3,2,Visual,TimeSeries,Geospatial
